{
  "type": "mod",
  "id": "com.example.blacklist_test",
  "version": "1.0.0",
  "name": "Blacklist Test",
  "description": "A test mod that verifies the security validator correctly identifies dangerous types in the assembly blacklist.",
  "license": "MIT",
  "icon": null,
  "contact": {
    "email": "test@example.com"
  },
  "authors": [
    {
      "name": "Test Author",
      "email": "test@example.com"
    }
  ],
  "contributors": [],
  "references": [
    {
      "name": "BlacklistTestMod",
      "file": "BlacklistTestMod.dll",
      "engine": { "name": "mono", "version": ">=0.0.0" }
    }
  ],
  "entrypoints": {
    "main": ["BlacklistTestMod.BlacklistTestInitializer"]
  },
  "relations": [],
  "constraints": []
}
