{
  "type": "mod",
  "id": "com.example.helloworld",
  "version": "1.0.0",
  "name": "Hello World Example",
  "description": "A simple example mod that prints 'Hello World!' during initialization.",
  "license": "MIT",
  "icon": null,
  "contact": {
    "email": "author@example.com"
  },
  "authors": [
    {
      "name": "Example Author",
      "email": "author@example.com"
    }
  ],
  "contributors": [],
  "references": [
    {
      "name": "HelloWorldMod",
      "file": "HelloWorldMod.dll",
      "engine": { "name": "mono", "version": ">=0.0.0" }
    }
  ],
  "entrypoints": {
    "main": ["HelloWorldMod.HelloWorldInitializer"]
  },
  "relations": [],
  "constraints": []
}
