{
  "type": "mod",
  "id": "api.nox.jint",
  "provides": [
    "fr.hactazia.jint",
    "jint"
  ],
  "name": "Jint system",
  "version": "1.0.0",
  "description": "Provides the Jint API for the jint.",
  "license": "GPL-3.0",
  "icon": null,
  "contact": {
    "email": "hactazia@gmail.com",
    "source": "https://github.com/AtelierVR/api.nox.jint",
    "website": "https://nox.hactazia.fr/",
    "issues": "https://github.com/AtelierVR/api.nox.jint/issues"
  },
  "authors": [
    {
      "name": "Hactazia",
      "email": "hactazia@gmail.com",
      "website": "https://hactazia.fr/"
    }
  ],
  "contributors": [],
  "relations": [],
  "entrypoints": {
    "main": [
      "api.nox.jint.Main"
    ]
  },
  "references": [],
  "permissions": []
}