{
  "type": "mod",
  "id": "api.nox.mirror",
  "provides": [
    "fr.hactazia.mirror",
    "mirror"
  ],
  "name": "mirror System",
  "version": "1.0.0",
  "description": "mirror system",
  "license": "GPL-3.0",
  "icon": null,
  "contact": {
    "email": "hactazia@gmail.com",
    "source": "https://github.com/AtelierVR/api.nox.mirror",
    "website": "https://nox.hactazia.fr/",
    "issues": "https://github.com/AtelierVR/api.nox.mirror/issues"
  },
  "authors": [
    {
      "name": "Hactazia",
      "email": "hactazia@gmail.com",
      "website": "https://hactazia.fr/"
    }
  ],
  "contributors": [],
  "relations": [],
  "entrypoints": {
    "client": [
      "api.nox.mirror.Main"
    ]
  },
  "references": [],
  
  "permissions": []
}