{
  "type": "mod",
  "id": "api.nox.controller",
  "provides": [
    "fr.hactazia.controller",
    "controller"
  ],
  "name": "controller API",
  "version": "1.0.0",
  "description": "API for controller",
  "license": "GPL-3.0",
  "icon": null,
  "contact": {
    "email": "hactazia@gmail.com",
    "source": "https://github.com/AtelierVR/api.nox.controller",
    "website": "https://nox.hactazia.fr/",
    "issues": "https://github.com/AtelierVR/api.nox.controller/issues"
  },
  "authors": [
    {
      "name": "Hactazia",
      "email": "hactazia@gmail.com",
      "website": "https://hactazia.fr/"
    }
  ],
  "contributors": [],
  "relations": [],
  "entrypoints": {
    "main": [
      "api.nox.controller.Main"
    ],
    "editor": [
      "api.nox.controller.Editor"
    ]
  },
  "references": [],
  
  "permissions": []
}